{
  "schema_version": "rules-residue.task-packet/1.0",
  "task_id": "RR-TASK-0004",
  "status": "PLANNED",
  "owner": "codex",
  "task_type": "integration",
  "objective": "Install the immutable R2 authority package, progressive-disclosure contracts, M2 planning inputs, authoring supersession, governance, schemas, acceptance packet, and provenance without implementing or changing runtime content.",
  "authority": [
    ".codex/plans/r2-authority-install/INSTALL_PLAN.md#R2-INSTALL-FROZEN-PLAN",
    ".codex/plans/r2-authority-install/package-disposition.yaml",
    "AGENTS.md#M1-AGENTS-CONTRACT",
    "README.md#M1-README-ENTRY",
    "/home/zyc14588/RULE_RESIDUAL_R2_AUTHORITY_AND_PROGRESSIVE_DELIVERY_v1.0.0/01_REPO_OVERLAY/governance/r2/decisions.r2.yaml",
    "/home/zyc14588/RULE_RESIDUAL_R2_AUTHORITY_AND_PROGRESSIVE_DELIVERY_v1.0.0/01_REPO_OVERLAY/governance/r2/traceability-matrix.r2.yaml"
  ],
  "inputs": [
    ".codex/routes/r2-authority-install-plan-request.json",
    ".codex/state/MILESTONE_PLAN.yaml",
    "governance/decisions.json",
    "governance/scope.json",
    "workflow/task-packet.schema.json",
    "tools/codex_route.py",
    "tools/validate_project.py",
    "tools/run_acceptance.py"
  ],
  "allowed_paths": [
    ".codex/prompts/r2/**",
    ".codex/routes/r2-authority-install-*.json",
    ".codex/SESSION_START.md",
    ".grok/ART_TASK_PROMPT.md",
    ".grok/r2/**",
    ".opencode/SCRIPT_TASK_PROMPT.md",
    ".opencode/r2/**",
    "AGENTS.md",
    "README.md",
    "authoring/README.md",
    "authoring/art/**",
    "authoring/characters/**",
    "authoring/equipment/**",
    "authoring/mysteries/**",
    "authoring/story/00_STORY_BIBLE.md",
    "authoring/story/01_TRUTH_BIBLE.md",
    "authoring/story/02_MAIN_MYSTERY_GRAPH.md",
    "authoring/story/03_RETURN_HOME_ARC.md",
    "authoring/story/04_REVEAL_POLICY.md",
    "authoring/world/**",
    "docs/acceptance/r2/**",
    "docs/authority/00_PROJECT_CHARTER.md",
    "docs/authority/10_OPEN_DECISIONS.md",
    "docs/authority/r2/**",
    "docs/implementation/r2/**",
    "docs/operations/agents/r2/**",
    "docs/operations/r2/**",
    "governance/decisions.json",
    "governance/evidence/r2-authority-install/**",
    "governance/r2/**",
    "governance/scope.json",
    "justfile",
    "reports/r2-authority-install/**",
    "schemas/r2/**",
    "tests/test_r2_installation.py",
    "tools/validate_project.py",
    "tools/validate_r2_install.py",
    "workflow/README.md",
    "workflow/examples/r2-art-task-packet.json",
    "workflow/examples/r2-script-task-packet.json"
  ],
  "forbidden_paths": [
    ".codex/plans/r2-authority-install/**",
    ".codex/state/MILESTONE_PLAN.yaml",
    "/home/zyc14588/RULE_RESIDUAL_R2_AUTHORITY_AND_PROGRESSIVE_DELIVERY_v1.0.0/**",
    "TRPG_PLATFORM/**",
    "dist/**",
    "game-package/**",
    "workflow/queue/RR-TASK-0004.json",
    "**/*.lua"
  ],
  "open_decisions": [
    "RR-O001",
    "RR-O002",
    "RR-O004",
    "RR-O005",
    "RR-O006",
    "RR-O007",
    "DEFER-R2-D12-001",
    "DEFER-R2-E18-001",
    "DEFER-R2-H20-001",
    "DEFER-R2-C13-001",
    "DEFER-R2-C14-001",
    "DEFER-R2-F12-001",
    "DEFER-R2-H16-001",
    "DEFER-R2-I18-001",
    "DEFER-R2-REGIONS-001",
    "DEFER-R2-BOSS-001"
  ],
  "acceptance": [
    "Every one of the 124 package files has exactly one frozen disposition and UNCLASSIFIED equals zero.",
    "R2 decisions total 191 with exact group counts 10/14/16/18/20/21/22/22/24/24, unique IDs, complete index, and 191-of-191 traceability.",
    "All installed Markdown Section IDs are present and globally unique; YAML, JSON, and Draft 2020-12 schemas validate.",
    "M1 RR-O003 and all active prose OPEN truth containers are explicitly SUPERSEDED_BY_R2 with no conflicting active truth.",
    "Player, GM, mechanical, audit, participant projection, and Agent memory layers remain separated and Truth Bible is not a runtime/package input.",
    "The repeated content-safety filter contains all 18 required stages and the absolute minor sexual-abuse red line.",
    "Codex, OpenCode, Grok, portable-agent, all adapters, M2 inputs, and independent acceptance contracts are discoverable from existing repository entry points.",
    "Repository-native Reading Map gates reject stale commit/tree/document, identity mismatch, missing/duplicate Section ID, bulk reads, and over-70-percent context.",
    "No game-package, package-lock, Lua, runtime, dist, or platform diff exists from the pinned source commit.",
    "just validate, just test, just acceptance, just codex-check, just r2-validate, python3 tools/run_acceptance.py, and git diff --check exit zero.",
    "A separate read-only ACCEPT worktree independently verifies the fixed candidate and all required negative probes without changing tracked files."
  ],
  "expected_outputs": [
    "R2 authority, governance, schema, authoring, operations, agent, M2-input, and independent-acceptance installation",
    "Package provenance and complete disposition evidence",
    "Repository-native R2 static validator and regression tests",
    "Fixed candidate commit/tree and independent ACCEPT evidence",
    "Final fast-forward-only integration with a clean target worktree"
  ],
  "notes": "Frozen PLAN TaskEnvelope. M2 implementation is explicitly excluded; after PASS the only next action is M2_PLAN."
}
